{
  "id": "opp-example",
  "source": "upwork",
  "job_url": "https://www.upwork.com/jobs/example",
  "title": "CRM automation with AI follow-up",
  "category": "crm-ai-automation",
  "budget_type": "fixed",
  "budget": "$500",
  "posted_at_text": "1 hour ago",
  "proposal_count_text": "Less than 5",
  "client_country": "United States",
  "client_spend_text": "$10K+",
  "payment_verified": true,
  "description_excerpt": "Need AI-assisted follow-up workflow for inbound leads.",
  "skills": ["CRM", "Automation", "OpenAI API"],
  "fit_score": 8,
  "client_quality_score": 8,
  "competition_score": 3,
  "scope_clarity_score": 7,
  "risk_score": 3,
  "connects_cost": 8,
  "expected_value_band": "medium",
  "recommended_action": "prefill_only",
  "decision_reason": "Clear CRM automation fit with verified payment and low proposal count.",
  "created_at": "2026-05-06T00:00:00Z"
}
